<?xml version="1.0" encoding="UTF-8"?>
<!-- #%L ff4j-core %% Copyright (C) 2013 Ff4J %% Licensed under the Apache 
	License, Version 2.0 (the "License"); you may not use this file except in 
	compliance with the License. You may obtain a copy of the License at http://www.apache.org/licenses/LICENSE-2.0 
	Unless required by applicable law or agreed to in writing, software distributed 
	under the License is distributed on an "AS IS" BASIS, WITHOUT WARRANTIES 
	OR CONDITIONS OF ANY KIND, either express or implied. See the License for 
	the specific language governing permissions and limitations under the License. 
	#L% -->
<ff4j xmlns="http://www.ff4j.org/schema/ff4j" xmlns:xsi="http://www.w3.org/2001/XMLSchema-instance"
	xsi:schemaLocation="http://www.ff4j.org/schema/ff4j http://ff4j.org/schema/ff4j-1.4.0.xsd">

	<features>
		<feature uid="AwesomeFeature" enable="true" />
	</features>
	
	<properties>
		<property name="a" value="AMER">
			<fixedValues>
				<value>AMER</value>
				<value>EAST</value>
				<value>EAST</value>
				<value>EAST</value>
			</fixedValues>
		</property>
		
		<property name="today" value="2015-08-31 12:12:00"  type="org.ff4j.property.PropertyDate" />
		
		<property name="pExo" value="Yihaaaa"  type="org.ff4j.placeholder.PropertyExotic" />
		
		<property name="c" value="12.5"  type="org.ff4j.property.PropertyDouble" />
		
		<property name="d" value="true"  type="org.ff4j.property.PropertyBoolean" />
		
		<property name="e" value="hello" />
		
		<property name="pInt" value="1" type="org.ff4j.property.PropertyInt">
			<fixedValues>
				<value>0</value>
				<value>1</value>
				<value>2</value>
				<value>3</value>
			</fixedValues>
		</property>
		
		<property name="logLevel" value="DEBUG"
			type="org.ff4j.property.PropertyLogLevel" />
	</properties>

</ff4j>
